{
  "id": "TUI-MULTI-01A",
  "title": "Native Pi TUI parallel worker proof A",
  "goal": "Create one tiny in-scope evidence note for the native Pi TUI parallel worker layout/lifecycle proof.",
  "status": "closed",
  "closed_by_run": "kd-20260708-030047-bc43bb8c",
  "closed_at": "2026-07-08T03:01:42.794656389+00:00",
  "depends_on": [
    "LAYOUT-05"
  ],
  "areas": [
    ".workflow/slices/TUI-MULTI-01A.json",
    "docs/design/evidence/tui-worker-multi-proof-A-2026-07-08.md"
  ],
  "acceptance": [
    "Create docs/design/evidence/tui-worker-multi-proof-A-2026-07-08.md stating that this is worker A for the native Pi TUI parallel proof and that KD-owned submit_worker_result artifacts are authoritative, not terminal text."
  ],
  "verify": [
    "test -f docs/design/evidence/tui-worker-multi-proof-A-2026-07-08.md",
    "grep -q submit_worker_result docs/design/evidence/tui-worker-multi-proof-A-2026-07-08.md",
    "grep -q 'terminal text' docs/design/evidence/tui-worker-multi-proof-A-2026-07-08.md"
  ]
}
